{"_id":"ws1","tenantId":"toc","url":"https://www.immigration.govt.nz/new-zealand-visas/apply-for-a-visa/about-visa/student-visa","label":"NZ Immigration student visa page","reputationTier":"official","checkIntervalHours":24,"active":true,"lastFetch":{"fetchedAt":"2026-09-01T00:00:00Z","hash":"abc123","diffFrom":null}}
